[
  {
    "eventType": "proof-of-play",
    "mediaId": "cmp-934883",
    "screenId": "store-00421-aisle7-endcap-1",
    "playedAt": "2026-01-06T14:22:09Z",
    "durationSeconds": 15,
    "result": "completed",
    "sessionId": "pop-77ab1290",
    "deviceState": {
      "temperature": "normal",
      "connectivity": "online"
    },
    "audit": {
      "signature": "MEYCIQDQâ€¦",
      "source": "signage-player"
    }
  }
]